{
  "agents": {
    "coder": {
      "id": "coder-1",
      "last_activity": null,
      "role": "code_generation",
      "status": "idle"
    },
    "coordinator": {
      "id": "coordinator-1",
      "last_activity": null,
      "role": "orchestrator",
      "status": "idle"
    },
    "deployer": {
      "id": "deployer-1",
      "last_activity": null,
      "role": "deployment",
      "status": "idle"
    },
    "tester": {
      "id": "tester-1",
      "last_activity": null,
      "role": "validation",
      "status": "idle"
    }
  },
  "errors": {
    "recent": []
  },
  "metadata": {
    "created_at": "2026-04-14T00:00:00Z",
    "last_updated": "2026-04-16T14:09:05Z",
    "version": "1.0"
  },
  "shared_context": {
    "current_goal": null,
    "decisions": {},
    "project_name": "personal-cloud",
    "project_status": "initialized"
  },
  "tasks": {
    "completed": [],
    "current": [],
    "failed": []
  }
}